{
  "profile": "supplied-filesystem",
  "context": "replace-cluster",
  "namespace": "existing-observability",
  "storage_class": "existing-retain",
  "provisioner": "example.local/provider",
  "max_total_gib": 16,
  "minimum_free_bytes": 2147483648,
  "minimum_free_inodes": 10000,
  "reserve_fraction": 0.2,
  "volumes": {
    "loki": {"claim": "existing-loki", "size_gib": 4, "worker": "replace-worker-1", "uid": "11111111-1111-4111-8111-111111111111"},
    "tempo": {"claim": "existing-tempo", "size_gib": 4, "worker": "replace-worker-2", "uid": "22222222-2222-4222-8222-222222222222"},
    "mimir": {"claim": "existing-mimir", "size_gib": 8, "worker": "replace-worker-2", "uid": "33333333-3333-4333-8333-333333333333"}
  }
}
